{
  "schema": "sqlite-task-row/v1",
  "taskId": "2026-06-11-kr-01-harness-infrastructure",
  "title": "Harness infrastructure baseline",
  "parentTaskId": "2026-06-11-parent-task",
  "canonicalStatus": "active",
  "coordinationStatus": "open",
  "rawStatus": "active",
  "packageDisposition": "active",
  "closeoutReadiness": "not_required",
  "lifecycleEngine": "local",
  "freshness": "fresh",
  "updatedAt": "2026-06-11T00:03:00.000Z",
  "source": "local-document",
  "sourcePath": "planning/modules/kernel-rewrite/tasks/2026-06-11-kr-01-harness-infrastructure/task_plan.md",
  "createdBy": {
    "name": "Harness User",
    "email": "harness@example.com"
  }
}
